{
  "verified": true,
  "consumed": true,
  "challenge_id": "44444444-4444-4444-8444-444444444444",
  "member_id": "22222222-2222-4222-8222-222222222222",
  "organization_id": "33333333-3333-4333-8333-333333333333",
  "operation": "human.management.credential.revoke",
  "authenticated_at": 1786492820000
}
